{
  "$schema": "https://json-schema.org/draft/2020-12/schema",
  "title": "ParticipaMX · state_profiles",
  "type": "object",
  "properties": {
    "schema_version": {
      "const": "2.0.0"
    },
    "election_year": {
      "type": "integer",
      "enum": [
        2009,
        2012,
        2015,
        2018,
        2021,
        2024
      ]
    },
    "election_type": {
      "type": "string",
      "enum": [
        "presidential",
        "midterm"
      ]
    },
    "unit": {
      "const": "state_rule_candidate"
    },
    "source_id": {
      "const": "ine_counted_lists"
    },
    "rate_unit": {
      "const": "proportion"
    },
    "data": {
      "type": "array",
      "items": {
        "type": "object",
        "properties": {
          "election_year": {
            "type": "integer",
            "enum": [
              2009,
              2012,
              2015,
              2018,
              2021,
              2024
            ],
            "minimum": 0
          },
          "state_code": {
            "type": "string"
          },
          "profile_id": {
            "type": [
              "string",
              "null"
            ],
            "enum": [
              "young_favorable",
              "young_unfavorable",
              "adult_favorable",
              "adult_unfavorable",
              "older_favorable",
              "older_unfavorable",
              null
            ]
          },
          "LN": {
            "type": [
              "integer",
              "null"
            ],
            "minimum": 0
          },
          "SV": {
            "type": [
              "integer",
              "null"
            ],
            "minimum": 0
          },
          "NV": {
            "type": [
              "integer",
              "null"
            ],
            "minimum": 0
          },
          "NS": {
            "type": [
              "integer",
              "null"
            ],
            "minimum": 0
          },
          "source_row_count": {
            "type": [
              "integer",
              "null"
            ],
            "minimum": 0
          },
          "sex_2_source_rows": {
            "type": [
              "integer",
              "null"
            ],
            "minimum": 0
          },
          "sex_2_nominal_count": {
            "type": [
              "integer",
              "null"
            ],
            "minimum": 0
          },
          "expected_peer_votes": {
            "type": [
              "number",
              "null"
            ],
            "minimum": 0
          },
          "specified_count": {
            "type": [
              "integer",
              "null"
            ],
            "minimum": 0
          },
          "participation_observed": {
            "type": [
              "number",
              "null"
            ],
            "minimum": 0,
            "maximum": 1
          },
          "nonparticipation_observed": {
            "type": [
              "number",
              "null"
            ],
            "minimum": 0,
            "maximum": 1
          },
          "participation_nominal": {
            "type": [
              "number",
              "null"
            ],
            "minimum": 0,
            "maximum": 1
          },
          "unspecified_rate": {
            "type": [
              "number",
              "null"
            ],
            "minimum": 0,
            "maximum": 1
          },
          "has_low_support": {
            "type": [
              "boolean",
              "null"
            ]
          },
          "has_high_ns": {
            "type": [
              "boolean",
              "null"
            ]
          },
          "segments": {
            "type": [
              "integer",
              "null"
            ],
            "minimum": 0
          },
          "near_reference_segments": {
            "type": [
              "integer",
              "null"
            ],
            "minimum": 0
          },
          "high_ns_segments": {
            "type": [
              "integer",
              "null"
            ],
            "minimum": 0
          },
          "matched_peer_reference": {
            "type": [
              "number",
              "null"
            ],
            "minimum": 0,
            "maximum": 1
          },
          "relative_turnout": {
            "type": [
              "number",
              "null"
            ]
          },
          "territorial_LN": {
            "type": [
              "integer",
              "null"
            ],
            "minimum": 0
          },
          "share_of_territorial_LN": {
            "type": [
              "number",
              "null"
            ],
            "minimum": 0
          }
        },
        "required": [
          "election_year",
          "state_code",
          "profile_id",
          "LN",
          "SV",
          "NV",
          "NS",
          "source_row_count",
          "sex_2_source_rows",
          "sex_2_nominal_count",
          "expected_peer_votes",
          "specified_count",
          "participation_observed",
          "nonparticipation_observed",
          "participation_nominal",
          "unspecified_rate",
          "has_low_support",
          "has_high_ns",
          "segments",
          "near_reference_segments",
          "high_ns_segments",
          "matched_peer_reference",
          "relative_turnout",
          "territorial_LN",
          "share_of_territorial_LN"
        ],
        "additionalProperties": false
      }
    },
    "warnings": {
      "type": "array",
      "items": {
        "type": "string"
      }
    }
  },
  "required": [
    "schema_version",
    "election_year",
    "election_type",
    "unit",
    "source_id",
    "rate_unit",
    "data",
    "warnings"
  ],
  "additionalProperties": false
}