{"schema_version":"2.0.0","election_year":2015,"election_type":"midterm","unit":"state_rule_candidate","source_id":"ine_counted_lists","rate_unit":"proportion","data":[{"election_year":2015,"state_code":"1","profile_id":"adult_favorable","LN":16024,"SV":9374,"NV":6650,"NS":0,"source_row_count":1305,"sex_2_source_rows":0,"sex_2_nominal_count":0,"expected_peer_votes":8767.73668900812,"specified_count":16024,"participation_observed":0.5849975037443834,"nonparticipation_observed":0.4150024962556166,"participation_nominal":0.5849975037443834,"unspecified_rate":0.0,"has_low_support":false,"has_high_ns":false,"segments":5,"near_reference_segments":2,"high_ns_segments":0,"matched_peer_reference":0.5471627988647104,"relative_turnout":0.037834704879673,"territorial_LN":867356,"share_of_territorial_LN":0.018474536407196124},{"election_year":2015,"state_code":"1","profile_id":"adult_unfavorable","LN":353495,"SV":136106,"NV":200409,"NS":16980,"source_row_count":28522,"sex_2_source_rows":0,"sex_2_nominal_count":0,"expected_peer_votes":174281.9756629303,"specified_count":336515,"participation_observed":0.4044574536053371,"nonparticipation_observed":0.595542546394663,"participation_nominal":0.38502949122335534,"unspecified_rate":0.04803462566655822,"has_low_support":false,"has_high_ns":false,"segments":17,"near_reference_segments":1,"high_ns_segments":0,"matched_peer_reference":0.5179025471759959,"relative_turnout":-0.11344509357065885,"territorial_LN":867356,"share_of_territorial_LN":0.407554683428719},{"election_year":2015,"state_code":"1","profile_id":"older_favorable","LN":3648,"SV":2194,"NV":1454,"NS":0,"source_row_count":1001,"sex_2_source_rows":0,"sex_2_nominal_count":0,"expected_peer_votes":2145.470287619446,"specified_count":3648,"participation_observed":0.6014254385964912,"nonparticipation_observed":0.3985745614035088,"participation_nominal":0.6014254385964912,"unspecified_rate":0.0,"has_low_support":false,"has_high_ns":false,"segments":3,"near_reference_segments":2,"high_ns_segments":0,"matched_peer_reference":0.5881223376149797,"relative_turnout":0.01330310098151155,"territorial_LN":867356,"share_of_territorial_LN":0.004205885472631768},{"election_year":2015,"state_code":"1","profile_id":"older_unfavorable","LN":114603,"SV":57898,"NV":53805,"NS":2900,"source_row_count":29279,"sex_2_source_rows":0,"sex_2_nominal_count":0,"expected_peer_votes":65004.05263893298,"specified_count":111703,"participation_observed":0.5183209045415074,"nonparticipation_observed":0.48167909545849263,"participation_nominal":0.5052049248274478,"unspecified_rate":0.02530474769421394,"has_low_support":false,"has_high_ns":false,"segments":19,"near_reference_segments":3,"high_ns_segments":0,"matched_peer_reference":0.5819364980254155,"relative_turnout":-0.0636155934839081,"territorial_LN":867356,"share_of_territorial_LN":0.1321291372861893},{"election_year":2015,"state_code":"1","profile_id":"young_favorable","LN":19971,"SV":8905,"NV":11066,"NS":0,"source_row_count":1019,"sex_2_source_rows":0,"sex_2_nominal_count":0,"expected_peer_votes":8042.902992443278,"specified_count":19971,"participation_observed":0.4458965499974964,"nonparticipation_observed":0.5541034500025036,"participation_nominal":0.4458965499974964,"unspecified_rate":0.0,"has_low_support":false,"has_high_ns":false,"segments":6,"near_reference_segments":2,"high_ns_segments":0,"matched_peer_reference":0.40272910682706314,"relative_turnout":0.04316744317043325,"territorial_LN":867356,"share_of_territorial_LN":0.02302514769022178},{"election_year":2015,"state_code":"1","profile_id":"young_unfavorable","LN":359565,"SV":88134,"NV":255023,"NS":16408,"source_row_count":19397,"sex_2_source_rows":0,"sex_2_nominal_count":0,"expected_peer_votes":128844.12980129752,"specified_count":343157,"participation_observed":0.2568328782452347,"nonparticipation_observed":0.7431671217547653,"participation_nominal":0.24511284468733052,"unspecified_rate":0.0456329175531545,"has_low_support":false,"has_high_ns":false,"segments":16,"near_reference_segments":1,"high_ns_segments":0,"matched_peer_reference":0.3754670014054719,"relative_turnout":-0.11863412316023719,"territorial_LN":867356,"share_of_territorial_LN":0.4145529632584544},{"election_year":2015,"state_code":"10","profile_id":"adult_favorable","LN":68427,"SV":39049,"NV":28795,"NS":583,"source_row_count":13909,"sex_2_source_rows":0,"sex_2_nominal_count":0,"expected_peer_votes":35928.15577583362,"specified_count":67844,"participation_observed":0.5755704262720358,"nonparticipation_observed":0.42442957372796414,"participation_nominal":0.5706665497537522,"unspecified_rate":0.008520028643664052,"has_low_support":false,"has_high_ns":false,"segments":36,"near_reference_segments":8,"high_ns_segments":0,"matched_peer_reference":0.5295701281739523,"relative_turnout":0.04600029809808348,"territorial_LN":1200244,"share_of_territorial_LN":0.05701090778208431},{"election_year":2015,"state_code":"10","profile_id":"adult_unfavorable","LN":439821,"SV":176383,"NV":221636,"NS":41802,"source_row_count":51309,"sex_2_source_rows":0,"sex_2_nominal_count":0,"expected_peer_votes":205525.7995532366,"specified_count":398019,"participation_observed":0.44315221132659494,"nonparticipation_observed":0.556847788673405,"participation_nominal":0.40103360230639284,"unspecified_rate":0.0950432107607413,"has_low_support":false,"has_high_ns":false,"segments":42,"near_reference_segments":6,"high_ns_segments":4,"matched_peer_reference":0.5163718303730138,"relative_turnout":-0.07321961904641888,"territorial_LN":1200244,"share_of_territorial_LN":0.3664429899253818},{"election_year":2015,"state_code":"10","profile_id":"older_favorable","LN":2442,"SV":1442,"NV":960,"NS":40,"source_row_count":1024,"sex_2_source_rows":0,"sex_2_nominal_count":0,"expected_peer_votes":1429.2760008877524,"specified_count":2402,"participation_observed":0.6003330557868443,"nonparticipation_observed":0.3996669442131557,"participation_nominal":0.5904995904995906,"unspecified_rate":0.01638001638001638,"has_low_support":false,"has_high_ns":false,"segments":3,"near_reference_segments":3,"high_ns_segments":0,"matched_peer_reference":0.5950358038666747,"relative_turnout":0.00529725192016961,"territorial_LN":1200244,"share_of_territorial_LN":0.002034586300785507},{"election_year":2015,"state_code":"10","profile_id":"older_unfavorable","LN":198871,"SV":92123,"NV":95021,"NS":11727,"source_row_count":64414,"sex_2_source_rows":0,"sex_2_nominal_count":0,"expected_peer_votes":109036.3954572105,"specified_count":187144,"participation_observed":0.492257299192066,"nonparticipation_observed":0.507742700807934,"participation_nominal":0.46322993297162485,"unspecified_rate":0.05896787364673582,"has_low_support":false,"has_high_ns":false,"segments":75,"near_reference_segments":4,"high_ns_segments":4,"matched_peer_reference":0.5826336695657381,"relative_turnout":-0.09037637037367213,"territorial_LN":1200244,"share_of_territorial_LN":0.16569214259767182},{"election_year":2015,"state_code":"10","profile_id":"young_favorable","LN":66439,"SV":29469,"NV":36412,"NS":558,"source_row_count":10707,"sex_2_source_rows":0,"sex_2_nominal_count":0,"expected_peer_votes":25611.04053387163,"specified_count":65881,"participation_observed":0.44730650718720116,"nonparticipation_observed":0.5526934928127988,"participation_nominal":0.4435497223016602,"unspecified_rate":0.008398681497313326,"has_low_support":false,"has_high_ns":false,"segments":39,"near_reference_segments":4,"high_ns_segments":0,"matched_peer_reference":0.38874699130055146,"relative_turnout":0.058559515886649705,"territorial_LN":1200244,"share_of_territorial_LN":0.05535457790249316},{"election_year":2015,"state_code":"10","profile_id":"young_unfavorable","LN":424078,"SV":119723,"NV":266244,"NS":38111,"source_row_count":34679,"sex_2_source_rows":0,"sex_2_nominal_count":0,"expected_peer_votes":144588.82013271726,"specified_count":385967,"participation_observed":0.3101897312464537,"nonparticipation_observed":0.6898102687535463,"participation_nominal":0.28231363098297957,"unspecified_rate":0.08986790165960036,"has_low_support":false,"has_high_ns":false,"segments":39,"near_reference_segments":12,"high_ns_segments":4,"matched_peer_reference":0.3746144622019946,"relative_turnout":-0.06442473095554091,"territorial_LN":1200244,"share_of_territorial_LN":0.35332649028030966},{"election_year":2015,"state_code":"11","profile_id":"adult_favorable","LN":504092,"SV":282338,"NV":180413,"NS":41341,"source_row_count":50991,"sex_2_source_rows":0,"sex_2_nominal_count":0,"expected_peer_votes":248382.84218429646,"specified_count":462751,"participation_observed":0.6101294216544103,"nonparticipation_observed":0.38987057834558975,"participation_nominal":0.5600922053910794,"unspecified_rate":0.08201082342112154,"has_low_support":false,"has_high_ns":false,"segments":64,"near_reference_segments":6,"high_ns_segments":7,"matched_peer_reference":0.5367526859678239,"relative_turnout":0.07337673568658643,"territorial_LN":4093632,"share_of_territorial_LN":0.12314052655441426},{"election_year":2015,"state_code":"11","profile_id":"adult_unfavorable","LN":1209437,"SV":518825,"NV":593437,"NS":97175,"source_row_count":104182,"sex_2_source_rows":0,"sex_2_nominal_count":0,"expected_peer_votes":569590.6666019744,"specified_count":1112262,"participation_observed":0.46645934141416323,"nonparticipation_observed":0.5335406585858368,"participation_nominal":0.4289805917960175,"unspecified_rate":0.08034730209179974,"has_low_support":false,"has_high_ns":false,"segments":28,"near_reference_segments":9,"high_ns_segments":3,"matched_peer_reference":0.5121011655544956,"relative_turnout":-0.045641824140332354,"territorial_LN":4093632,"share_of_territorial_LN":0.29544350835639355},{"election_year":2015,"state_code":"11","profile_id":"older_favorable","LN":98953,"SV":60717,"NV":35213,"NS":3023,"source_row_count":29820,"sex_2_source_rows":0,"sex_2_nominal_count":0,"expected_peer_votes":55662.10444855816,"specified_count":95930,"participation_observed":0.63293